{"created_at":"2026-09-22T02:21:35.847Z","expires_at":"2026-09-23T02:21:35.847Z","lineage":{"catalog":{"revision":"66ba2dffe5ba2fb9cda6838b2f0814fd79da585f99e5a6e60f741fa0d22ccd94"},"context_envelope":{"digest":"a94d46373e15acd36507e0e9b004b01ee313b11903b0f40624e8ab1ac0680b11","persisted":false,"volatile":true},"evidence":[{"content_hash":"9a773c3d1f73206b7aafddf52a40d0a827dc85a99807c49d2931878f156ea62c","document_id":"brain:memory/decisions/2026-09-21-seloa-muse-canonical-paths.md","locator":"memory/decisions/2026-09-21-seloa-muse-canonical-paths.md"}],"index":{"fresh":true,"generation_id":"a32f744237031a53d5b14bbf5037c0be7d19edab1c68d494979d6e4b9f7c29c1","max_age_seconds":86400,"observed_at":"2026-09-22T01:00:00.317Z","reason_code":"fresh","revision":"54f08a556068160fcc6b18e027791a74aaf4f760c025f04ea3b70bdb7373a75b"},"runtime":{"implementation_digest":"2b8b587c37f44d01dc52f6e105d9c293b364c4022263fb33983a677535f6bdde","repository":"yohan-mcp","source_revision":"81ea431ccba4ee93c8836e882537506ec6bb82f1"},"task_context":{"reason_codes":["shared_repository_evidence_included","missing_project_goal","missing_next_action"],"schema":"task-context/v1","status":"partial"}},"ownership":{"active_writer":"codex-p2","content_digest":"c020faf11daecc6ca982fd484df31501ab51968f9ef8bf9c27d6fa502a724a4d","current_gate":"goal-resolution","future_skew_seconds":300,"liveness":"active","max_age_seconds":3600,"source_path":".tmp/p2-session-resume-ownership.json","source_ref":"git/ef862f6b5c20b299a9dff6a2e533f192c3c54461","takeover":"forbidden","updated_at":"2026-09-22T02:21:11.613Z","writer_epoch":1},"policy":{"allowed_work":["inspect_context","select_project_goal","prepare_resolution_evidence"],"execution_mode":"read_only_until_goal_selected","forbidden_work":["implementation","repository_writes","writer_takeover","Merge without a human gate"],"goal_selection_required":true,"human_gates":["Muse project goal selection"]},"receipts":{"content":{"algorithm":"sha256","canonicalization":"sorted-json-utf8-v1","digest":"908c1b9f301ddecb300df4fd9da466095b36e3b0d31e89bf91da03445eec9562"},"delivery":null},"repository":{"canonical_path":"products/muse","git":{"branch":"master","dirty":false,"sha":"ef862f6b5c20b299a9dff6a2e533f192c3c54461"},"id":"muse","manifest_source":"ops/public-dev-bootstrap/repos.json"},"schema":"session-resume-packet/v1","source_ref":"git/ef862f6b5c20b299a9dff6a2e533f192c3c54461","task":{"blockers":["missing_project_goal","missing_next_action"],"current_gate":"goal-resolution","goal":{"id":null,"source_ref":null,"state":"missing","status":null,"title":null},"next_action":"Select and record one active Muse project goal before any implementation","next_action_source":"explicit_resolution"},"validation":{"machine_status":"REAL_MACHINE_UNVERIFIED","reason_code":"single_device_fixture_only"}}